{
  "table": "sku_device_map",
  "owner": "DataEngineering",
  "description": "Map of license SKU to related device types.",
  "database": "definitions",
  "datatype": "csv",
  "schema": [
    {
      "name": "sku",
      "type": "string",
      "description": "License SKU."
    },
    {
      "name": "status",
      "type": "string",
      "description": "Customer availability status of license SKU."
    },
    {
      "name": "core_hardware",
      "type": "string",
      "description": "Core hardware list associated with license SKU."
    },
    {
      "name": "acc_hardware",
      "type": "string",
      "description": "Accessory list associated with license SKU."
    }
  ]
}
