{
  "table": "telematics_ld_targets",
  "owner": "FirmwareVdp",
  "description": "Table 'telematics_ld_targets' generated from 'Dataweb Configurations.xlsx'.",
  "database": "definitions",
  "datatype": "csv",
  "schema": [
    {
      "name": "org_id",
      "type": "bigint"
    },
    {
      "name": "device_id",
      "type": "string"
    },
    {
      "name": "make",
      "type": "string"
    },
    {
      "name": "model",
      "type": "string"
    },
    {
      "name": "year_start",
      "type": "bigint"
    },
    {
      "name": "year_end",
      "type": "bigint"
    },
    {
      "name": "engine_model",
      "type": "string"
    },
    {
      "name": "engine_type",
      "type": "string"
    },
    {
      "name": "fuel_type",
      "type": "string"
    },
    {
      "name": "market",
      "type": "string"
    },
    {
      "name": "feature_flag",
      "type": "string"
    }
  ]
}
