{
  "table": "canonical_fuel_hydrogen_type",
  "owner": "FirmwareVdp",
  "description": "The enum representing the type of hydrogen fuel. THIS TABLE IS AUTOGENERATED. For updates, modify go/infra/vdp.",
  "database": "definitions",
  "datatype": "csv",
  "schema": [
    {
      "name": "id",
      "type": "bigint",
      "description": "The id of the hydrogen type."
    },
    {
      "name": "name",
      "type": "string",
      "description": "The name of the hydrogen type."
    }
  ]
}
