{
  "table": "telematics_obd_value_mapping",
  "owner": "FirmwareVdp",
  "description": "Table 'telematics_obd_value_mapping' generated from 'Dataweb Configurations.xlsx'.",
  "database": "definitions",
  "datatype": "csv",
  "schema": [
    {
      "name": "type",
      "type": "string"
    },
    {
      "name": "obd_value",
      "type": "string"
    },
    {
      "name": "notes",
      "type": "string"
    }
  ]
}
