{
  "table": "vdp_priorities",
  "owner": "FirmwareVdp",
  "description": "Product defined priorities for data extracted from customer installations. This is intended to be used for prioritizing work.",
  "database": "definitions",
  "datatype": "csv",
  "schema": [
    {
      "name": "product_area",
      "type": "string"
    },
    {
      "name": "sub_product_area",
      "type": "string"
    },
    {
      "name": "name",
      "type": "string"
    },
    {
      "name": "product_priority",
      "type": "bigint"
    },
    {
      "name": "stat",
      "type": "string"
    },
    {
      "name": "field",
      "type": "string"
    },
    {
      "name": "definition_table",
      "type": "string"
    },
    {
      "name": "value_min",
      "type": "float"
    },
    {
      "name": "value_max",
      "type": "float"
    },
    {
      "name": "delta_min",
      "type": "double"
    },
    {
      "name": "delta_max",
      "type": "double"
    },
    {
      "name": "delta_over_time_min",
      "type": "double"
    },
    {
      "name": "delta_over_time_max",
      "type": "double"
    },
    {
      "name": "confluence_link",
      "type": "string"
    }
  ]
}
