{
  "table": "activity_type",
  "owner": "FirmwareVdp",
  "description": "The enum representing signal promotion activity types (UNDEFINED, CREATED, PENDING_APPROVAL, PENDING_ROLLBACK, APPROVED, REJECTED, POPULATION_IGNORE_VIN_ENABLED, POPULATION_IGNORE_VIN_DISABLED, RESTORED). THIS TABLE IS AUTOGENERATED. For updates, modify go/infra/vdp.",
  "database": "definitions",
  "datatype": "csv",
  "schema": [
    {
      "name": "id",
      "type": "bigint",
      "description": "The id of the activity type."
    },
    {
      "name": "name",
      "type": "string",
      "description": "The name of the activity type."
    }
  ]
}
