{
  "table": "door_open_status",
  "owner": "FirmwareVdp",
  "description": "The enum representing the door open status. THIS TABLE IS AUTOGENERATED. For updates, modify go/infra/vdp.",
  "database": "definitions",
  "datatype": "csv",
  "schema": [
    {
      "name": "id",
      "type": "bigint",
      "description": "The id of the door open status."
    },
    {
      "name": "name",
      "type": "string",
      "description": "The name of the door open status."
    }
  ]
}
