{
  "table": "canonical_fuel_gaseous_type",
  "owner": "FirmwareVdp",
  "description": "The enum representing the type of gaseous fuel. This type is stored in the Canonical Fuel tables as a bitmap in database with bits defined in the enum. THIS TABLE IS AUTOGENERATED. For updates, modify go/infra/vdp.",
  "database": "definitions",
  "datatype": "csv",
  "schema": [
    {
      "name": "id",
      "type": "bigint",
      "description": "The id of the gaseous type."
    },
    {
      "name": "name",
      "type": "string",
      "description": "The name of the gaseous type."
    }
  ]
}
