{
  "table": "telematics_cet_eld_and_diagnostics_preference",
  "owner": "FirmwareVdp",
  "description": "Table 'eldAndDiagnosticsPreference' generated from 'Cable Recommendation CST Set (New Format).xlsx'.",
  "database": "definitions",
  "datatype": "csv",
  "schema": [
    {
      "name": "id",
      "type": "string"
    },
    {
      "name": "regions",
      "type": "string"
    },
    {
      "name": "make",
      "type": "string"
    },
    {
      "name": "model",
      "type": "string"
    },
    {
      "name": "year_start",
      "type": "bigint"
    },
    {
      "name": "year_end",
      "type": "bigint"
    },
    {
      "name": "engine_model",
      "type": "string"
    },
    {
      "name": "powertrain",
      "type": "string"
    },
    {
      "name": "fuel_group",
      "type": "string"
    },
    {
      "name": "exclude_models",
      "type": "string"
    },
    {
      "name": "row_count",
      "type": "bigint"
    },
    {
      "name": "cable",
      "type": "string"
    },
    {
      "name": "eld_and_diagnostics_preference_yes",
      "type": "string"
    },
    {
      "name": "eld_and_diagnostics_preference_no_with_odometer",
      "type": "string"
    },
    {
      "name": "eld_and_diagnostics_preference_no_with_other_diagnostics",
      "type": "string"
    },
    {
      "name": "vg34",
      "type": "boolean"
    },
    {
      "name": "vg54_nah",
      "type": "boolean"
    },
    {
      "name": "vg54_na_eu",
      "type": "boolean"
    },
    {
      "name": "vg55",
      "type": "boolean"
    },
    {
      "name": "ae_notes",
      "type": "string"
    }
  ]
}
