{
  "table": "j1939_txid_to_source",
  "owner": "FirmwareVdp",
  "description": "This table maps source identifiers defined in J1939-DA to english. THIS TABLE IS AUTOGENERATED. For updates, modify go/infra/vdp.",
  "database": "definitions",
  "datatype": "csv",
  "schema": [
    {
      "name": "id",
      "type": "bigint"
    },
    {
      "name": "name",
      "type": "string"
    }
  ]
}
