{
  "table": "can_id_type",
  "owner": "FirmwareVdp",
  "description": "CanConfig_CanIdType enum mapping table. THIS TABLE IS AUTOGENERATED. For updates, modify go/infra/vdp.",
  "database": "definitions",
  "datatype": "csv",
  "schema": [
    {
      "name": "id",
      "type": "bigint",
      "description": "The id of the can id type."
    },
    {
      "name": "name",
      "type": "string",
      "description": "The name of the can id type."
    }
  ]
}
