{
  "table": "historical_ifta_report",
  "owner": "IftaCore",
  "description": "Historical IFTA data from reports v1. This data is needed to allow customers to view historical data after the switch over to reports v2 using data pipelines. This table is joined with the IFTA report in the combined_distance table.",
  "database": "fuel_maintenance",
  "region_to_location": {
    "us-west-2": "s3://samsara-databricks-playground/historical-ifta-daily/",
    "eu-west-1": "s3://samsara-eu-databricks-playground/historical-ifta-daily/",
    "ca-central-1": "s3://samsara-ca-databricks-playground/historical-ifta-daily/"
  },
  "datatype": "csv",
  "schema": [
    { "name": "org_id", "type": "bigint", "description": "$org_id_default_description" },
    { "name": "device_id", "type": "bigint", "description": "The device id of this hour of data." },
    {
      "name": "driver_id",
      "type": "bigint",
      "description": "The id of the driver assigned to this vehicle during this hour of data."
    },
    { "name": "jurisdiction", "type": "string", "description": "The jurisdiction this hour of driving took place in." },
    { "name": "end_ms", "type": "bigint", "description": "The end time in milliseconds of this hour of data." },
    {
      "name": "duration_ms",
      "type": "bigint",
      "description": "The duration in milliseconds of this hour of data. This will always be 3,600,000 ms (1 hour)."
    },
    {
      "name": "gps_distance_m",
      "type": "bigint",
      "description": "The distance traveled in meters as recorded by GPS during this hour. This is calculated using our trips-based algorithm."
    },
    {
      "name": "odo_distance_m",
      "type": "bigint",
      "description": "The distance traveled in meters as recorded by odometer during this hour. This is calculated using our trips-based algorithm."
    },
    {
      "name": "toll_distance_m",
      "type": "bigint",
      "description": "The distance traveled in meters on toll roads during this hour. This is calculated using our trips-based algorithm."
    },
    {
      "name": "time_ms",
      "type": "bigint",
      "description": "The duration the engine was running, in milliseconds, during this hour. This is calculated using our trips-based algorithm."
    },
    {
      "name": "tripless_gps_distance_m",
      "type": "bigint",
      "description": "The distance traveled in meters as recorded by GPS during this hour. This is calculated using our tripless algorithm, which does not depend on trips to calculate distance."
    },
    {
      "name": "tripless_odo_distance_m",
      "type": "bigint",
      "description": "The distance traveled in meters as recorded by odometer during this hour. This is calculated using our tripless algorithm, which does not depend on trips to calculate distance."
    },
    {
      "name": "tripless_toll_distance_m",
      "type": "bigint",
      "description": "The distance traveled in meters on troll roads during this hour. This is calculated using our tripless algorithm, which does not depend on trips to calculate distance."
    },
    {
      "name": "tripless_engine_on_ms",
      "type": "bigint",
      "description": "The duration the engine was running, in milliseconds, during this hour. This is calculated using our tripless algorithm, which does not depend on trips to calculate distance."
    },
    {
      "name": "use_odometer",
      "type": "boolean",
      "description": "A boolean value that denotes whether this org was using odometer values to calculate IFTA distances during this time."
    },
    {
      "name": "use_tripless",
      "type": "boolean",
      "description": "A boolean value that denotes whether this org was using the tripless algorithm to calculate IFTA distances during this time."
    }
  ],
  "partitions": [{ "name": "date", "type": "timestamp", "description": "The date of this hour of data." }]
}
