{
  "table": "obd_value_lock_cleared_reason",
  "owner": "FirmwareVdp",
  "description": "Map OBD VALUE locking cleared reasons using ObdLock logic. THIS TABLE IS AUTOGENERATED. For updates, modify go/infra/vdp.",
  "database": "definitions",
  "datatype": "csv",
  "schema": [
    {
      "name": "id",
      "type": "bigint",
      "description": "The id of the OBD value lock cleared reason."
    },
    {
      "name": "name",
      "type": "string",
      "description": "The name of the OBD value lock cleared reason."
    }
  ]
}
