{
  "table": "j1708_autodetect_bus",
  "owner": "FirmwareVdp",
  "description": "J1708CanAutodetectedBus enum mapping table. Reported using osDJ1708AutodetectResults. THIS TABLE IS AUTOGENERATED. For updates, modify go/infra/vdp.",
  "database": "definitions",
  "datatype": "csv",
  "schema": [
    {
      "name": "id",
      "type": "bigint",
      "description": "The id of the J1708 autodetect bus."
    },
    {
      "name": "name",
      "type": "string",
      "description": "The name of the J1708 autodetect bus."
    }
  ]
}
