{
  "table": "properties_fuel_fuelgroup",
  "owner": "FirmwareVdp",
  "description": "The enum representing the Fuel Group for Fuel Properties. THIS TABLE IS AUTOGENERATED. For updates, modify go/infra/vdp.",
  "database": "definitions",
  "datatype": "csv",
  "schema": [
    {
      "name": "id",
      "type": "bigint",
      "description": "The id of the fuel group."
    },
    {
      "name": "name",
      "type": "string",
      "description": "The name of the fuel group."
    }
  ]
}
